{
  "schemaVersion": "1.0.0",
  "planId": "770e8400-e29b-41d4-a716-446655440002",
  "sessionId": "660e8400-e29b-41d4-a716-446655440001",
  "createdAt": "2026-08-04T12:02:00Z",
  "state": "reviewed",
  "actions": [
    {
      "actionId": "880e8400-e29b-41d4-a716-446655440003",
      "manager": "homebrew",
      "type": "update_tap",
      "mutationClass": "safe",
      "preVerificationStatus": "pending",
      "rollbackEligible": false
    }
  ]
}
